subaddress,amount,title
87GU4bSGVRcXAjhWPYd7e32msPAunm7k49FDbN9fe35hGEBCAYX8aqHg7HBmvjoJwqZ94Kbty8pMAevx3Lu6tVxA37stsdu,27.713403156454,Integrate p2pool mining into Monero GUI Wallet
891zZHEhA8cQvZ27oCRTf5cwFQkjjPMJMVjZ7aEHYFiMTx3Gr61hMEJMjzkjJhaqfcJEqmEC4YSmjgaF7t9rytZkVfoSXWo,23.300000092794,Implement view tags to decrease wallet sync times in Monero
82t6WdEaHV2VMroBDd1jgjHmRqkjanzFQLbmTvg3V1z7EMvvGxNn4UaGtcP8ozvFjpBmoxTJBPoYeLbzZPfDCF1wGUSUswF,11.500007208337,ETH<->XMR atomic swap
89UNCiB9c1j9KmnKiQfaxp8Pzfs7tgRKPFgGXFpdkLVoEZjMMnaxUu2gnnENv585UBTmear2UDpTDcWGMdkmWnCd1kxQ39F,3.84205290861,"Android GUI Miner App for running XMRig, P2Pool, etc."
8Aexb6HyxmBARMmF6EoNagGiFmZdTBftdcJrDN7naUQtNXgAfpPDKpm2hYimf6WhQM8CNxscnaVcfTt3miKLLaqQQFvpbP3,2.3,BCH<>XMR Atomic Swaps
83KdPam57nwCtemedYGNSi6FhPDHhpia6EPZQYMpg6sDDV6mEB4Uf1dHvPmhWEGPioT975jqnGoL2LuUDHvjmVRe9qEQKhm,1.25470824,BCH<>XMR Atomic Swaps
84ttWbXAttg8N1U8aonJQeFGs4anwzH7WPwbkD7LSjtNEEjS1x71i2NWp5ZPGZvXL264havwZcXGKj5jWCeoKXTVSnirCH7,1.2042069,Bounties site accessible via I2P
87EQs9WfuYzcQfqnTzqVXzMGLfsQ6FnSjhBnAzj4MDwM1LQCVbvd63Rd6NV8LPTGAnP1WAJq16iy9RjTYUMC3BvaTbB342Q,1.0050649549919999,Monero Guides - Mini Series
89PmQeJ5egbFtwWWe5Pmb8Wgi9vTnXYyAb7Jrz1J23f9M6FW8TT9gkzH1Km7Rmi32YfKvx9FSidsrJPyZaDVPsuK6Bt72Ks,0.84353021,i2p baked into the monero GUI
87agKiZWoV9L6b98pjXYzEERwAn1htRivBcdU6Qf2aTmXmDP5FHLufQUdm9ZTqRzAyS3F5DpqeKrAjTEoBcTUNTdSXHBQUV,0.807660845458,Monero Desktop Drag n' Drop Widget Dashboard
8BEjRUHSVTZYVjF2eSxk9JaNnFwzFLTRQbMcar2UvZug5xjemckTx9hiVEMex2VDi9D5sVVdVPJGBTdAKdB2vtGPQmswAG7,0.4842069,Bounties site accessible via tor
87J3FUbwxrW25hGZk1bjQgLdZeNSSboVq5Y7VWRkTtmqUChNuLEs8bPJZ6gaj3Ee5KjLXKBdJmkJSAVqBQL72f995eTE9rT,0.440004654401,Add Monero <-> BTC Atomic Swaps to Bisq
85ukNyR6a7xfWj5F5A75SwgZwkF8vb8WJKiytkH1gaDxBM9nyvVeasrdCqfwDPfUm3RBL4bo9mQpTMuXaPbyiuvxALnwPyv,0.295849781144,Setup Monero Dev List website
8Aj5PDpkWPyQNmoLcYBfZmPFUpU5uaBiyWkHQkUExBtRdpm4T9zrNyQK9T7k2SAPWzj8TxwWksi2XKXoJ8uMJdumSvJJyPd,0.29431006292399997,Gift Wallet on paper
84B81SDhLd19XzcK8FHTF3echXy7ystxcV8FuXyDbVoFTnAgvZHUnBBVgDLujnnT5CS3UuwpegY3iXd3guFjqNCB8d2xoR1,0.29229309,"Monero Bounties site, parse donation address as link"
84k52UHXLbA8LNJKQhjuHNWdA5dgnHsigL3K4ERBMw6rZppXFw6axgrfe9ycqkDr5UeWSFvDaH7SvMsPupWFEwuo5d5jqYG,0.2474807,Implement background wallet sync via view keys on Monerujo
89EkLhUP5pJYuCvD2SZFEtisSjjkaCm2SdM9C25APEwq4rxEtbn41L4bvwJN7Xn21d5KtscUYcLMHChAjZVSop2q4SESxXr,0.24653211558399998,Desktop service/GUI for running a Monero node on boot/in the background
87JhAybgFbLMEtnhuHvwqfWc9QHJaUqGSAxaTiqaBv2JGPVatUbbpULXyxBqpgZPhG1sk1cbWJW9XVGeprVmNCrNBhnbxEE,0.24024988271699999,Implement background wallet sync via view keys in Cake Wallet for Android
85mnUV7dNcMV58MXz267Y7LqLVbRfT4agbVqeMK3Ekpe8nTC3u6qgfX4CtACwYYm96BDk6y299wfuhEMtkNmYW2L5u6yzJt,0.24,File server that accepts Monero payments for downloads
8317thWakBtfj4Ron4si6nb4yVLwd4ex2M378RHivib6MaWjzAjM2DdABYfcza5eDTE2Huhqx879iPVcjsVhsty5EBv5Hwh,0.204233851314,Video: Dispelling Monero Misconceptions and FUD
87mJiMKTAVhRBvJZqLN9fW3GZ2FbkLkqU12eufkuPiYG6YypR2ikF21e5ihfYwNMAw1G8G1WfN89eirYmeYuf4YpEAYsjD6,0.2042069,Fix monero-gui decoy selection bug (monero-gui issue #3733)
834S5qXu4CQ4MbCuyVAhsbZn3sajT1on56WmZ4zQzS6Q1CAi2tPv1LVitPPvHCcn1xTyif3HiS6XwPv1LW8yW7Dp7B6fxqx,0.20021333599399999,Video Tutorial: How to build a Basic Wordpress Shop that accepts Monero (for Dummies!)
8ANVRJDv49v6ERwfbr4jrZQ5ASxdctqDpWVPA5juCEsRXj8pR9d8szzb45DiojMobJWdq67XpFCTNBnmfYmY9q2pHcw8VtG,0.17841379999999998,Implement viewkey-based background refresh to significantly reduce wallet sync time
84kimpgbiHrA5bQr6QHgcVfVRrEdecJtn5sxQRSzzqJL7WMGhV2RvMpAywvaYxQk49fwkUs1eV1mWJaT2eWwk4PHVikNyXr,0.1462069,Authentication Token / Proxy
84TXnuSwvn9jNSKBVt9XxWjBBeAgjAqKoKbJ2LdZQbxG7uzKC7NzXs53a1R6EaL5YGMWZWDbNSHne1h48sKquqJ9A9Cg6e6,0.11716599999999999,Translate Bitcoin <> Monero atomic swaps guides to Chinese Mandarin
898NaW2gYdbdtPawGAELuw4FpMzCgVMQj7BtFkEYqTBB9WZxdsebZ9v2UU4itNp6RNdotqzjydDD6MZpixBVcVXMSXzJJup,0.1142069,Odysee - Support for tipping in Monero
83UXh3SQZGk63yCWA8cQcQFrYL6xat3aNASZcz7USgy94neK8proFxU1BJhxr4PWNPJy1ScKX2oxy6TX3BmcGJk67JbJmXG,0.11,Twitter bot for COMIT BTC atomic swaps
89vpzM8C6Pp3q6QenEKpQijoNhgMFLBYR5ScZnJCwNGTE9m1Q1HQyqK6HJCij81oq93Abw5jpoz3Aec1yMQ2o2YL77ueVTU,0.10420689999999999,Develop Nym Monero Transaction Broadcaster
88d2S4hC13yHEyWS5nwH15UWnrZXrgqCga4DEcFMCqRu4Xz3R8VWRrpdsWDxA8fPxg4tACeMtbU6VG19F5cfR6itLfMyp4z,0.0323,GitHub Pages site for Monero Means Money
83adHMJ7PdQZZAitxfgEaiiZyV4uHzhJxB6yZqXuM5xWMTQHvr2BPjPBcUhcQSdRLkLXH5NyNqJMjR3wKRV4LRCRPZ6tpYu,0.016827599999999998,Fix Bounties bot not finding multiple donations in a single transaction
82pD595o4bGWzFqsCcJV8kYdFjKp5YqiBFTcN1mmcztfQJGfPFT2wwCZppr4idDD4229GBTq1UvaAMz8uv8EpUPzB4McmgD,0.008413799999999999,Bounty to provide Monero liquidity on smart contract platform (Solana)
82mkPGHsEr5czajm7kv4JR9sqgAgXaQRHau77HAeWhQyd2NWBjVhSZS3YMo1xpU5m5cWnYR6i6cS9e3fzwz4TsUsT6ZU57y,0.008413799999999999,Video Tutorial: How to set up BTCPayServer for Monero Only on VPS/Home Server
84VLTZZvSf18kP6JitPgC3gyjrMstotstjFUsY3yrQ5uByhweRiq3PE5h2zgihgjoAhaM3bQRLaB9JdGsz4CeSepLkbHRF6,0.00620896942,Plug and Play Monero Marketplace on I2P
8BRRrjPAJXFP8CgBF7vQKVfpmGq6EPgJods3hcZpZQ51TirfPuDYVur33CrqYi6ekMLQvqSUPku9ofwY12J96dtyDkwxNju,0.006,Android GUI Monero Node
89j2NVUJWhXV4PcYPhf5h9iAZxJ56Bt3pd4PGvgkY6Fy8dJpxsMdgiN6HWNvqh44U9SCXvr83ufJSPAMpEBC7cBKAAcmeTh,0.005972207734,Make an ATOM/rss feed available for Bounty posts and comments
85P5A3CBE9ZDJh52p7WrwAYcA7hHBykZ3TwTxtj2zpsgcuexRMz8XvE4D9y1NqGNLdYHCF1i7U7f6eJLFS5s58wQTvswNmM,0.0042068999999999995,Upgrade Monero integration to support Odoo 15
88cmQpcDZFBUoFBRPxuvkh3MEiwwjq6TKNVafS4xedTpJj7mLoN1XLC36mh8AxBHNV9LnMDgnNyazVs5X26g23euA8hmmXU,0.0042068999999999995,Develop Monero payments integration for Ecwid ecommerce
866L4jJANbL5hoMn1NdmaEYC4GTXJNUQtLLhRPjTVfr8Zv543qiwqUqgPCrBnVmcPmaozSAnMy2a98QtJTKitgEp9RoPrwH,0.0042068999999999995,Add bounties.monero.social Matrix link somewhere on the bounties.monero.social page
86Ce8uPoLMn56LWoeAoKt2Es9sxwM2XKY8vBzb7S4png2LRz8VgNUiMFmEGUZWpmcaC7YSTN7mz16WvuowQj5XXZPsKQ73Q,0.004206,Develop Monero payments integration for Magento
8AqxFnPSjtWeatoxHpWpYmC6PNuuqP8xCZRCktfpyHNBabx1zFAMuSTMe5Fwt81hR72HWHhDkDyLjibEm9G4797MCHFmtt5,0.003,add alternative download methods on getmonero.org
85uTUd3D8LTQqmazaT8uixY8eHTw7AHfCSyRZXZ8aggobU3K9f9r5gaP4P2e6LXtNp3D8o4MXQarEHJa2Pe5638f5N9UMHi,0.001,Look and spend unspent outputs in monerujo
87Dmdzb7uoTczaWynmqL31KUsV18U8Ku2g3dfwS6jPtiaXCdx9aa8jcNMBwh1iLJrv6ccpPyLUidHNa6S5JyxcXE9UxUTmJ,0.001,Make a YOU WOULDNT DOWNLOAD A VIDEO remix for monero
87Y5PRZ6surNxHsZASFbnKiDJMepYf7E5Wnabz52a3ytXfDbXxGWBaNRa4ZVJSStLDKEkst1w6JEe3S3byvMopZfVG8hy6c,9.999999999999999e-05,i2p baked into the monero GUI
